{
  "schema": "cwk.rt055.amendment9-final-qa.v1",
  "data_class": "PUBLIC_SYNTHETIC_AND_CLOSED_OPS_COUNTS_ONLY",
  "status": "PUBLIC_EVIDENCE_VERIFIED_READINESS_BLOCKED",
  "source_commit": "6b32584023cd27096e7c2167c0c28f47b380f922",
  "readiness": "BLOCKED",
  "gate_failure_not_overridden": true,
  "local_regression": {
    "tests": 254,
    "failures": 0,
    "errors": 0,
    "skipped": 0,
    "exit_code": 0
  },
  "compiled_files": 142,
  "source_bound_prior_behavior_mutations": 13,
  "prior_mutations_detected": true,
  "mutations_repeated": false,
  "all_source_tests_contracts_unchanged": true,
  "independent_source_privacy_input_history": "PASS",
  "independent_native_workload": "PASS",
  "independent_core_inventory": "PASS",
  "main_runtime_workspace_scoring_input": "PASS",
  "regular_freeze_verification": "PASS",
  "no_popen_coordinator_precheck": "FAIL_CONFIRMED",
  "denied_probe_children_started": 0,
  "before": "PASS",
  "after_claims": 1,
  "after": "FAIL",
  "after_error_kind": "TransientStorageError",
  "after_snapshot_verified": false,
  "after_retried": false,
  "new_window_status": "INVALID",
  "ready_receipt_created": false,
  "new_candidate_attempts": 0,
  "new_arms": 0,
  "global_formal_exposure": 0,
  "global_formal_queries": 0,
  "global_formal_results": 0,
  "formal_coordinator_invocations": 0,
  "cleanup_failures": 0,
  "remaining_runtime": 0,
  "candidate_processes": 0,
  "full_nas_index_invariance": null,
  "historical_drift_cleared": false,
  "production_changes_performed": false,
  "full_repository_ci_claimed": false,
  "mechanical": {
    "status": "PASS",
    "compiled": 142,
    "schemas": 10,
    "schema_negative_rejections": 1500,
    "private_field_or_digest_hits": 0,
    "secret_hits": 0,
    "links": 208,
    "anchors": 31,
    "historical_public_files_unchanged": 107,
    "document_prefixes_unchanged": 4,
    "pool_tier_seed_quality_algorithm_exposure_unchanged": true,
    "full_repository_ci_claimed": false,
    "all_source_scripts_unchanged_from_deployed_commit": true,
    "public_rt055_only": true
  },
  "method_gates": {
    "aodw_exit_code": 0,
    "aodw_warning_count": 1,
    "aodw_warning_kind": "EXISTING_HOST_HANDOVER_SKILL_NOT_INSTALLED",
    "governance_exit_code": 0,
    "governance_tracked_files": 956
  },
  "publication_scope": "PUBLIC_RT055_EVIDENCE_AND_APPEND_ONLY_DOCUMENTS",
  "source_scripts_in_evidence_commit": false,
  "runs_private_handover_in_evidence_commit": false,
  "push_performed": false,
  "merge_performed": false
}
